{
  "schema": "grant-audit-transparency-checkpoint-finalization-policy-v1",
  "policy_version": "1.0.0",
  "created_at": "2026-03-07T03:30:00.000Z",
  "updated_at": "2026-03-07T03:30:00.000Z",
  "threshold": 1,
  "authorized_witnesses": [
    {
      "witness_id": "witness-1",
      "display_name": "Independent Witness 1",
      "public_key_pem_path": "keys/transparency-witness-1-public.pem",
      "public_key_fingerprint_sha256": "e3c21c12dd1d586b4c4fccb6882d4d0ff9249eb2eadaed7cec9037ce9d3a5fa0"
    }
  ],
  "notes": "Phase 7.17 initial threshold policy. Raise threshold and append authorized witnesses as new witness keys are added."
}
